{
  "schema_version": "1.0.0",
  "generated_at": "2026-08-17T13:16:23",
  "project_root": "/mnt/sdcard/Projects/Sgdk Forge/tools/sgdk_wrapper/modelo",
  "gdd_reference": "/mnt/sdcard/Projects/Sgdk Forge/tools/sgdk_wrapper/modelo/doc/11-gdd.md",
  "assets": [
    {
      "asset_path": "res/branding/brand_author_logo.png",
      "asset_role": "other",
      "is_placeholder": false,
      "placeholder_tag": null,
      "evaluations": {
        "silhouette": {
          "score": 4,
          "notes": "Fill ratio: 0.62, bbox: 212x52"
        },
        "scale": {
          "conforms_to_canon": true,
          "head_metric": null,
          "notes": "Size: 224x64, role: other"
        },
        "lineart": {
          "score": 4,
          "notes": "Dark palette entries: 4/16"
        },
        "pose": {
          "readability": 3,
          "notes": "Proporcao horizontal; pode ser sprite de acao."
        },
        "appeal": {
          "score": 5,
          "notes": "Unique hue buckets: 12, palette entries: 16"
        },
        "animation_coherence": {
          "applicable": false,
          "score": null,
          "notes": "Requer strip de animacao para avaliar."
        },
        "gdd_adherence": {
          "applicable": true,
          "conforms": true,
          "notes": "Aderencia basica ao GDD verificada por presenca de keywords."
        },
        "aaa_pattern_adherence": {
          "applicable": false,
          "conforms": true,
          "notes": "Avaliacao basica; requer revisao humana para AAA."
        }
      },
      "artistic_pass": true,
      "failure_reasons": []
    },
    {
      "asset_path": "res/branding/brand_engine_logo.png",
      "asset_role": "other",
      "is_placeholder": false,
      "placeholder_tag": null,
      "evaluations": {
        "silhouette": {
          "score": 4,
          "notes": "Fill ratio: 0.80, bbox: 206x61"
        },
        "scale": {
          "conforms_to_canon": true,
          "head_metric": null,
          "notes": "Size: 224x80, role: other"
        },
        "lineart": {
          "score": 4,
          "notes": "Dark palette entries: 3/16"
        },
        "pose": {
          "readability": 3,
          "notes": "Proporcao horizontal; pode ser sprite de acao."
        },
        "appeal": {
          "score": 5,
          "notes": "Unique hue buckets: 9, palette entries: 16"
        },
        "animation_coherence": {
          "applicable": false,
          "score": null,
          "notes": "Requer strip de animacao para avaliar."
        },
        "gdd_adherence": {
          "applicable": true,
          "conforms": true,
          "notes": "Aderencia basica ao GDD verificada por presenca de keywords."
        },
        "aaa_pattern_adherence": {
          "applicable": false,
          "conforms": true,
          "notes": "Avaliacao basica; requer revisao humana para AAA."
        }
      },
      "artistic_pass": true,
      "failure_reasons": []
    },
    {
      "asset_path": "res/branding/brand_fx_tiles.png",
      "asset_role": "background",
      "is_placeholder": false,
      "placeholder_tag": null,
      "evaluations": {
        "silhouette": {
          "score": 1,
          "notes": "Fill ratio: 1.00, bbox: 128x32"
        },
        "scale": {
          "conforms_to_canon": true,
          "head_metric": null,
          "notes": "Size: 128x32, role: background"
        },
        "lineart": {
          "score": 4,
          "notes": "Dark palette entries: 6/16"
        },
        "pose": {
          "readability": 3,
          "notes": "Proporcao horizontal; pode ser sprite de acao."
        },
        "appeal": {
          "score": 5,
          "notes": "Unique hue buckets: 14, palette entries: 16"
        },
        "animation_coherence": {
          "applicable": false,
          "score": null,
          "notes": "Requer strip de animacao para avaliar."
        },
        "gdd_adherence": {
          "applicable": true,
          "conforms": true,
          "notes": "Aderencia basica ao GDD verificada por presenca de keywords."
        },
        "aaa_pattern_adherence": {
          "applicable": false,
          "conforms": true,
          "notes": "Avaliacao basica; requer revisao humana para AAA."
        }
      },
      "artistic_pass": true,
      "failure_reasons": []
    },
    {
      "asset_path": "res/branding/brand_presents_text.png",
      "asset_role": "other",
      "is_placeholder": false,
      "placeholder_tag": null,
      "evaluations": {
        "silhouette": {
          "score": 4,
          "notes": "Fill ratio: 0.59, bbox: 96x18"
        },
        "scale": {
          "conforms_to_canon": true,
          "head_metric": null,
          "notes": "Size: 112x24, role: other"
        },
        "lineart": {
          "score": 4,
          "notes": "Dark palette entries: 5/16"
        },
        "pose": {
          "readability": 3,
          "notes": "Proporcao horizontal; pode ser sprite de acao."
        },
        "appeal": {
          "score": 5,
          "notes": "Unique hue buckets: 11, palette entries: 16"
        },
        "animation_coherence": {
          "applicable": false,
          "score": null,
          "notes": "Requer strip de animacao para avaliar."
        },
        "gdd_adherence": {
          "applicable": true,
          "conforms": true,
          "notes": "Aderencia basica ao GDD verificada por presenca de keywords."
        },
        "aaa_pattern_adherence": {
          "applicable": false,
          "conforms": true,
          "notes": "Avaliacao basica; requer revisao humana para AAA."
        }
      },
      "artistic_pass": true,
      "failure_reasons": []
    },
    {
      "asset_path": "res/branding/brand_project_logo.png",
      "asset_role": "other",
      "is_placeholder": false,
      "placeholder_tag": null,
      "evaluations": {
        "silhouette": {
          "score": 1,
          "notes": "Fill ratio: 1.00, bbox: 220x72"
        },
        "scale": {
          "conforms_to_canon": true,
          "head_metric": null,
          "notes": "Size: 240x88, role: other"
        },
        "lineart": {
          "score": 4,
          "notes": "Dark palette entries: 5/16"
        },
        "pose": {
          "readability": 3,
          "notes": "Proporcao horizontal; pode ser sprite de acao."
        },
        "appeal": {
          "score": 5,
          "notes": "Unique hue buckets: 11, palette entries: 16"
        },
        "animation_coherence": {
          "applicable": false,
          "score": null,
          "notes": "Requer strip de animacao para avaliar."
        },
        "gdd_adherence": {
          "applicable": true,
          "conforms": true,
          "notes": "Aderencia basica ao GDD verificada por presenca de keywords."
        },
        "aaa_pattern_adherence": {
          "applicable": false,
          "conforms": true,
          "notes": "Avaliacao basica; requer revisao humana para AAA."
        }
      },
      "artistic_pass": true,
      "failure_reasons": []
    },
    {
      "asset_path": "res/branding/forge_bg_a_props_320x224.png",
      "asset_role": "background",
      "is_placeholder": false,
      "placeholder_tag": null,
      "evaluations": {
        "silhouette": {
          "score": 4,
          "notes": "Fill ratio: 0.63, bbox: 226x146"
        },
        "scale": {
          "conforms_to_canon": true,
          "head_metric": null,
          "notes": "Size: 320x224, role: background"
        },
        "lineart": {
          "score": 4,
          "notes": "Dark palette entries: 6/256"
        },
        "pose": {
          "readability": 3,
          "notes": "Proporcao horizontal; pode ser sprite de acao."
        },
        "appeal": {
          "score": 5,
          "notes": "Unique hue buckets: 12, palette entries: 256"
        },
        "animation_coherence": {
          "applicable": false,
          "score": null,
          "notes": "Requer strip de animacao para avaliar."
        },
        "gdd_adherence": {
          "applicable": true,
          "conforms": true,
          "notes": "Aderencia basica ao GDD verificada por presenca de keywords."
        },
        "aaa_pattern_adherence": {
          "applicable": false,
          "conforms": true,
          "notes": "Avaliacao basica; requer revisao humana para AAA."
        }
      },
      "artistic_pass": true,
      "failure_reasons": []
    },
    {
      "asset_path": "res/branding/forge_bg_b_320x224.png",
      "asset_role": "background",
      "is_placeholder": false,
      "placeholder_tag": null,
      "evaluations": {
        "silhouette": {
          "score": 1,
          "notes": "Fill ratio: 1.00, bbox: 320x224"
        },
        "scale": {
          "conforms_to_canon": true,
          "head_metric": null,
          "notes": "Size: 320x224, role: background"
        },
        "lineart": {
          "score": 4,
          "notes": "Dark palette entries: 6/256"
        },
        "pose": {
          "readability": 3,
          "notes": "Proporcao horizontal; pode ser sprite de acao."
        },
        "appeal": {
          "score": 5,
          "notes": "Unique hue buckets: 12, palette entries: 256"
        },
        "animation_coherence": {
          "applicable": false,
          "score": null,
          "notes": "Requer strip de animacao para avaliar."
        },
        "gdd_adherence": {
          "applicable": true,
          "conforms": true,
          "notes": "Aderencia basica ao GDD verificada por presenca de keywords."
        },
        "aaa_pattern_adherence": {
          "applicable": false,
          "conforms": true,
          "notes": "Avaliacao basica; requer revisao humana para AAA."
        }
      },
      "artistic_pass": true,
      "failure_reasons": []
    },
    {
      "asset_path": "res/branding/logo_author_192x32.png",
      "asset_role": "other",
      "is_placeholder": false,
      "placeholder_tag": null,